{
  "snapshotSchemaVersion": 3,
  "snapshotVersion": 813,
  "parentVersion": 812,
  "serverInstanceId": "srv-0198f2a1",
  "brokerFromSequence": 10321,
  "brokerToSequence": 10328,
  "createdAt": "2026-08-19T12:34:56.789Z",
  "state": {
    "tasks": {
      "task-1": {
        "title": "开会",
        "note": "",
        "schedule": { "startAt": "2026-08-20T01:00:00.000Z", "endAt": null },
        "completed": false,
        "itemType": "task",
        "recurrence": null,
        "alarm": { "enabled": false, "offsetMinutes": 0 },
        "colorId": 0,
        "location": { "lat": null, "lng": null },
        "extras": {},
        "listId": null,
        "checklist": [],
        "lifecycle": "active",
        "deletedAt": null
      }
    },
    "customLists": {
      "list-1": { "title": "工作", "color": "gold", "lifecycle": "active", "deletedAt": null }
    },
    "journals": {},
    "goals": {},
    "insights": {}
  }
}
